timestamp,machine_id,technician,urgency,transcript,ai_response,detected_language,source,audio_filename
2026-04-02 23:02:39,M-3944,Ali,Medium — fix within shift,"Hello, this is Ali. I have a problem in line to the bearing of the conveyor number 2 is making a strange sound. Please, it has to be checked in the next shift.","Fault Assessment: Possible bearing failure or misalignment on Conveyor 2. The ""strange sound"" likely indicates unusual friction or stress on the bearing components. Further inspection is required to determine the exact cause and severity of the issue.

Recommended Action: Immediately inspect Conveyor 2's bearing assembly for signs of damage, overheating, or looseness. Lubricate the bearing if necessary and check alignment. If the sound persists or damage is evident, replace the bearing during the next shift.

Urgency Validation: The declared urgency of ""Medium"" is appropriate. A failing bearing can lead to conveyor downtime and potentially damage other components. Addressing the issue within the shift or early in the next shift minimizes the risk of a major breakdown.
",en,microphone,mic_recording.wav
2026-04-02 23:08:09,M-3944,Ali,Medium — fix within shift,"Recasting urgent support for CLB. The pneumatic actuator is intermittently misfiring, resulting in a 20% scrap rate. We are currently paused to prevent further material loss. Please send someone to recalibrate the sensor and check the air pressure levels.","Fault Assessment: Pneumatic Actuator Malfunction. The reported misfiring suggests a problem within the pneumatic system controlling the CLB process. This likely involves either the actuator itself, the controlling sensor, or the air supply to the system. The increased scrap rate confirms a functional defect that needs immediate attention.

Recommended Action: Dispatch a technician to the M-3944 machine. They should first verify air pressure levels are within specified tolerances. Next, recalibrate the sensor that provides feedback for actuator positioning and function. If the problem persists, inspect the actuator for physical damage or internal leaks.

Urgency Validation: Appropriate. A 20% scrap rate and production pause justify a medium urgency requiring attention within the shift. The immediate cessation of operations to prevent further material loss indicates the problem is significantly impacting production efficiency.
",en,microphone,mic_recording.wav
2026-04-02 23:12:05,M-3944,Ali,Medium — fix within shift,Argeons maintained as needed on station 12. The safety interlock on the hydraulic press is falling to engage. The machine is low-toe for safety. We cannot resume production until the safety circuit is repaired and cleared.,"Fault Assessment: A critical safety component, the safety interlock on the hydraulic press at station 12, is malfunctioning and failing to engage reliably. This creates a hazardous condition by bypassing a key safety feature, potentially leading to injury. The machine is essentially unsafe to operate due to this failure.

Recommended Action: Immediately lock out and tag out the hydraulic press at station 12. Electrical maintenance should inspect the safety interlock circuit, diagnose the cause of the failure (sensor, wiring, or control logic), and repair or replace the faulty components. Thoroughly test the interlock function after repair to ensure proper operation before production resumes.

Urgency Validation: The declared medium urgency, requiring repair within the shift, is appropriate. Given the direct impact on operator safety and the inability to resume production without a functioning safety interlock, a prompt response is necessary to mitigate risk and minimize downtime.
",en,microphone,mic_recording.wav
